大園鄉埔心村24鄰中正東路一段163巷,2014,1,0,1
大園鄉埔心村中正東路二段,2014,2,0,6
蘆竹鄉南榮村中正路,2014,4,0,5
蘆竹鄉南竹路一段,2014,12,0,18
平鎮市義興里育達路與廣德街,2014,1,0,1
中壢市文化里中華路精忠街,2014,1,0,2
楊梅市校前路22巷,2014,1,0,1
楊梅市瑞塘里永美路,2014,4,0,5
中壢市聖德路一段,2014,4,0,8
觀音鄉草漯村長興路,2014,4,0,5
觀音鄉三和村產業道路,2014,1,0,1
楊梅市楊江里大模路,2014,3,0,3
中壢市內定里文中路二段358巷,2014,1,0,1
桃園市新埔七街173巷,2014,2,0,2
龍潭鄉中山村東龍路303巷,2014,1,0,1
龜山鄉大坑路三段,2014,4,0,5
大園鄉內海村台61線32公里0公尺處南向內側車道,2014,1,0,1
蘆竹鄉南崁村新南路二段,2014,2,0,2
八德市和平路重慶街,2014,1,0,2
大溪鎮仁和路一段,2014,16,0,20
平鎮市新光路,2014,8,0,12
中壢市環西路二段與環西路二段300巷,2014,1,0,1
八德市廣隆里中路街,2014,1,0,1
桃園市中正路876巷,2014,2,0,2
楊梅市瑞塘里萬大路115巷,2014,3,0,3
平鎮市東勢里金陵路,2014,13,0,18
桃園市中山路563巷,2014,1,0,2
龜山鄉文化二路52巷,2014,5,0,6
桃園市自強里南平路,2014,4,0,5
大園鄉竹圍村國際路三段,2014,1,0,2
觀音鄉大湖路一段,2014,1,0,1
新屋鄉社子村中興路,2014,6,0,9
蘆竹鄉福祿一街,2014,1,0,1
楊梅市上湖里楊湖路三段,2014,4,0,7
大溪鎮康莊路勝利街,2014,1,0,1
楊梅市福德街87巷,2014,1,0,1
桃園市中山路延壽街,2014,7,0,7
新屋鄉九斗村8鄰產業道路,2014,2,0,2
龍潭鄉武漢村成功路506巷,2014,1,0,2
平鎮市南勢里台66線路,2014,2,0,2
楊梅市中山北路一段,2014,5,0,6
平鎮市湧豐里南豐、工業二路,2014,1,0,1
蘆竹鄉南崁村南祥路,2014,1,0,1
桃園市新埔里南平路同安街,2014,1,0,2
桃園市國際路,2014,6,0,6
桃園市建國路建明街,2014,1,0,1
楊梅市梅新里校前路,2014,1,0,2
中壢市普強里環中東路與幸福街,2014,1,0,1
中壢市利民路與國泰街,2014,2,0,3
中壢市山東里山東路,2014,1,0,1
八德市茄苳里永豐路與永豐路352巷,2014,1,0,1
大園鄉埔心村桃園國際機場航站北路,2014,4,0,10
平鎮市金山街,2014,2,0,2
平鎮市金陵里環南路3段321巷,2014,2,0,2
中壢市強國路,2014,3,0,4
楊梅市新榮里梅高路,2014,1,0,1
桃園市三元里民光東路,2014,1,0,1
桃園市南埔里永安路吉安街,2014,2,0,3
中壢市復興里富華街,2014,1,0,1
中壢市中山、明德路,2014,1,0,1
龍潭鄉北興村中興路九龍段340巷,2014,1,0,2
新屋鄉頭洲村7鄰青田路,2014,3,0,3
觀音鄉建國路,2014,1,0,1
桃園市民有三街,2014,2,0,4
楊梅市大同里新農街245巷,2014,3,0,4
桃園市會稽里大有路,2014,8,0,10
大園鄉三石村三和路3巷,2014,1,0,1
蘆竹鄉新興街,2014,14,0,20
龜山鄉山頂村山鶯路,2014,1,0,1
中壢市普慶里中山東路二段281巷,2014,1,0,1
蘆竹鄉南崁路175巷,2014,4,0,7
中壢市東園路,2014,7,0,9
平鎮市建安里平東路一段,2014,5,0,7
中壢市環中東路685巷,2014,3,0,3
龍潭鄉中正村中正路194巷,2014,1,0,1
中壢市永興里中央西路一段,2014,2,0,2
平鎮市東社里台66線路,2014,3,0,4
桃園市民光東路,2014,3,0,3
桃園市建國里大林路,2014,6,0,8
桃園市仁愛路,2014,2,0,2
大溪鎮南興里仁和路二段548巷,2014,1,0,1
平鎮市復興里民族路文化街,2014,3,0,5
八德市大義里義勇街63巷,2014,1,0,1
蘆竹鄉上興路大興四街,2014,1,0,1
平鎮市北富里金陵路三段79巷,2014,1,0,1
八德市廣隆里建國路,2014,1,0,2
中壢市中華路一段與中華路一段619巷,2014,1,0,2
中壢市三民路一段,2014,3,0,3
中壢市民族路六段,2014,6,0,7
新屋鄉望間村6鄰產業道路,2014,1,0,1
龜山鄉茶專路,2014,6,0,8
中壢市普忠路211巷,2014,3,0,7
蘆竹鄉南竹路一段桃園街,2014,3,0,3
中壢市自信里永福路,2014,9,0,12
中壢市龍岡路三段與龍門街,2014,1,0,1
楊梅市四維里四維路,2014,3,0,5
蘆竹鄉錦中村南崁路一段、聯福街,2014,1,0,3
桃園市泰山里宏昌六街與玉山街78巷,2014,1,0,2
桃園市同安里大興西路一段同安街,2014,4,0,4
新屋鄉社子村東福路,2014,3,0,4
中壢市新興路,2014,6,0,8
中壢市中央西路一段,2014,18,0,22
中壢市復華里中華路長興街,2014,1,0,1
桃園市建國里建國東路,2014,5,0,8
大園鄉田心村華興路與中園街,2014,1,0,1
平鎮市南勢里中豐路南勢一段158巷,2014,1,0,1
桃園市中興里永安路,2014,8,0,10
中壢市成功里成章三街,2014,1,0,1
八德市大華里介壽路二段133巷,2014,3,0,3
中壢市中正里榮民路榮安十三街,2014,3,0,6
蘆竹鄉五福一路,2014,5,0,8
平鎮市金陵里金陵路與振平街,2014,1,0,1
龜山鄉嶺頂村振興路,2014,1,0,1
中壢市新明里中豐路,2014,1,0,2
八德市霄裡里新生路,2014,11,0,14
八德市茄明里中華路5巷,2014,4,0,5
平鎮市金陵路與振平街,2014,1,0,1
大溪鎮瑞仁里桃56線1.5公里處(瑞仁路,2014,1,0,1
桃園市明德里中正路,2014,2,0,2
楊梅市上湖里富民街,2014,2,0,5
桃園市中寧里大興西路二段69巷,2014,4,0,7
平鎮市復旦里廣平路,2014,1,0,1
中壢市新北園路,2014,4,0,6
龍潭鄉中正村中正路500巷,2014,1,0,1
大溪鎮文化路與文化路125巷,2014,1,0,2
中壢市環中東路151巷,2014,2,0,2
龜山鄉萬壽路二段744巷,2014,2,0,3
中壢市東興里元化地下道,2014,1,0,1
桃園市長美里博愛路,2014,3,0,3
中壢市普忠里新中北路249巷,2014,3,0,5
桃園市中平里中山路泰昌三街,2014,3,0,3
龜山鄉山頂村興業街,2014,1,0,1
桃園市春日路中興街,2014,3,0,6
大溪鎮民生路,2014,1,0,1
桃園市國際路一段414巷,2014,6,0,7
大溪鎮康莊路天祥街,2014,1,0,1
桃園市東門里成功路二段朝陽街,2014,2,0,3
桃園市鎮撫街,2014,6,0,9
蘆竹鄉坑子村山林路三段,2014,1,0,1
中壢市自忠二街,2014,1,0,2
龍潭鄉中山村大昌路一段251巷,2014,3,0,3
"龜山鄉樂善\村復興一路",2014,1,0,1
中壢市中正路2段,2014,2,0,2
中壢市金華里六合路九和街,2014,1,0,1
龍潭鄉武漢村中興路55巷,2014,2,0,2
中壢市永福里中園路與西園路二段,2014,4,0,6
桃園市大豐里建國路,2014,5,0,7
蘆竹鄉海湖村西部濱海快速道路,2014,1,0,2
觀音鄉坑尾村中山路,2014,2,0,2
中壢市自治里環中東路,2014,4,0,7
龍潭鄉中正村龍華路,2014,6,0,9
中壢市青埔里領航南路與青埔路二段,2014,1,0,1
大溪鎮忠泰街16巷,2014,1,0,1
中壢市日新路協同街,2014,1,0,1
大園鄉溪海村6鄰崙后子16之30號旁產業道路,2014,1,0,2
桃園市復興路玉山街,2014,7,0,8
蘆竹鄉大竹路新興街,2014,1,0,1
桃園市南華街,2014,5,0,6
龍潭鄉上林村中原路一段,2014,6,0,7
平鎮市民族路二段與文化街8巷,2014,1,0,1
中壢市仁美里華勛街,2014,1,0,2
中壢市健行路與中北路二段,2014,2,0,2
桃園市富國路850巷,2014,2,0,2
楊梅市四維里文化街56巷,2014,2,0,3
中壢市永光里民權路三段15巷,2014,2,0,3
楊梅市大同里新農街,2014,6,0,9
中壢市五權里正光街20巷,2014,2,0,3
中壢市永興里中山路270巷,2014,1,0,2
桃園市同安里中正路同德五街,2014,2,0,2
平鎮市洪圳路,2014,6,0,7
八德市瑞祥里興豐路836巷,2014,3,0,4
八德市白鷺里永豐南路31巷,2014,4,0,4
中壢市環中東路榮安一街,2014,2,0,3
蘆竹鄉南崁村新南路一段305巷,2014,2,0,2
桃園市永興里埔新路1巷,2014,1,0,3
觀音鄉大觀路三段,2014,1,0,1
中壢市中華路一段與精忠二街,2014,1,0,1
大園鄉大園村中山北路,2014,11,0,13
桃園市建國里林森路,2014,5,0,8
桃園市文化里中正路,2014,13,0,19
大溪鎮員林路二段與三元一街,2014,2,0,2
楊梅市楊湖路一段773巷,2014,1,0,1
八德市大成里建國路,2014,4,0,5
桃園市中正路與北興街,2014,1,0,1
大溪鎮瑞源里石園路,2014,2,0,3
桃園市大有路寶山街,2014,2,0,3
楊梅市紅梅里武營街,2014,3,0,4
桃園市國際路一段678巷,2014,1,0,1
平鎮市新榮里中豐路,2014,2,0,2
龍潭鄉中山村中正路161巷,2014,3,0,4
桃園市中埔里寶慶路,2014,1,0,1
中壢市龍岡里龍岡路三段412巷,2014,1,0,2
平鎮市宋屋里延平路三段428巷,2014,2,0,2
中壢市舊民里中央西路,2014,1,0,1
桃園市莊敬里南平路新埔八街,2014,1,0,1
八德市和平路991巷,2014,5,0,8
八德市介壽路二段361巷,2014,2,0,2
桃園市自強里莊敬路一段181巷,2014,1,0,1
平鎮市復興里育達路二段,2014,3,0,4
中壢市新興里龍岡路一段273巷,2014,1,0,2
龜山鄉龜山村中興路一段,2014,1,0,2
桃園市福林里介新街,2014,2,0,3
八德市大義里義勇街,2014,6,0,11
平鎮市南勢里南東路215巷,2014,2,0,4
桃園市春日路鹽庫西街,2014,3,0,5
大園鄉國際路一段,2014,2,0,2
大溪鎮仁德六街,2014,2,0,3
平鎮市東勢里福龍路,2014,1,0,1
龜山鄉龜山村長壽路481巷,2014,1,0,2
中壢市領航北路,2014,3,0,3
平鎮市莊敬里中豐南豐路,2014,1,0,2
大溪鎮民權東路,2014,6,0,9
桃園市長安里長春路愛二街,2014,1,0,2
楊梅市金龍里中興路,2014,3,0,3
八德市大明里桃鶯路與和平路1442巷,2014,1,0,1
楊梅鎮三民里瑞溪路一段220巷,2014,1,0,1
中壢市忠義里中華路一段復華街,2014,2,0,2
桃園市慈文里永安路慈光街,2014,3,0,5
蘆竹鄉南崁路二段228巷,2014,1,0,1
桃園市西門里三民路三段,2014,9,0,12
新屋鄉頭洲村台66線路,2014,5,0,12
平鎮市東勢里平東路二段,2014,1,0,1
中壢市大享街,2014,2,0,2
桃園市三民路一段鎮撫街,2014,3,0,3
平鎮市新富里中豐路新富二街,2014,3,0,4
楊梅市雙榮里雙榮路60巷,2014,1,0,1
平鎮市華安里平東路246巷,2014,1,0,1
蘆竹鄉南興村奉化路,2014,2,0,2
平鎮市金陵路4段,2014,1,0,1
中壢市普強里惠州街,2014,1,0,2
八德市重慶街,2014,4,0,4
龜山鄉中興路171巷,2014,4,0,6
中壢市復華里南園二路,2014,1,0,1
龜山鄉龜山一路,2014,3,0,3
蘆竹鄉南興村奉化路、南順七街,2014,1,0,2
八德市建國路422巷,2014,1,0,1
平鎮市金星里中豐中庸路,2014,1,0,1
八德市大勇里介壽路一段,2014,6,0,8
大園鄉內海村13鄰中山北路,2014,2,0,2
大溪鎮三元一街111巷,2014,1,0,1
桃園市中正里正光街,2014,7,0,11
蘆竹鄉錦順街,2014,1,0,1
平鎮市新榮里環南路二段,2014,7,0,7
新屋鄉永興村5鄰產業道路,2014,1,0,1
平鎮市義興里延平路二段155巷,2014,1,0,1
龜山鄉樹人路26巷,2014,1,0,1
八德市大智里永福西街,2014,3,0,4
蘆竹鄉南崁路222巷,2014,1,0,1
大園鄉果林村三民路二段果林街,2014,3,0,3
中壢市普忠里普忠路,2014,9,0,12
中壢市中豊北路,2014,2,0,2
桃園市龍岡里上海路國強一街,2014,2,0,2
中壢市榮民路165巷,2014,3,0,3
桃園市龍鳳里國豐六街,2014,1,0,1
龍潭鄉中豐路,2014,15,0,17
龜山鄉新路村中興路一段,2014,1,0,1
桃園市大興里大興路民有十六街,2014,2,0,3
中壢市振興里環中東路二段867巷,2014,1,0,1
桃園市榮華街64巷,2014,5,0,5
桃園市會稽里大有路與大德三街,2014,1,0,2
桃園市中山路泰昌三街,2014,5,0,5
蘆竹鄉新南路一段,2014,7,0,8
大園鄉內海村2鄰內海墘14-1號前(附近)台61線32公里700公尺處南向外側車道,2014,1,0,1
楊梅市三湖里楊湖路二段一巷,2014,1,0,1
大溪鎮介壽路與仁善一街,2014,2,0,3
中壢市龍岡路三段與龍岡路三段460巷,2014,1,0,1
桃園市青溪里三民路,2014,5,0,7
中壢市德義里中山東路一段,2014,10,0,17
平鎮市北富里金陵路二段,2014,1,0,3
桃園市介壽路介新街,2014,8,0,23
龜山鄉振興路229巷,2014,4,0,5
楊梅市金溪里中山北路二段56巷,2014,1,0,1
龜山鄉明德路162巷,2014,2,0,2
龍潭鄉龍祥村中豐路,2014,5,0,6
桃園市東門里成功路二段,2014,3,0,6
桃園市大興西路二段139巷,2014,5,0,6
楊梅鎮瑞塘里中山北路二段,2014,1,0,1
平鎮市平安里南平路,2014,5,0,5
中壢市環中東路與榮安一街,2014,6,0,8
桃園市大興西路二段80巷,2014,3,0,4
大溪鎮桃56線與東龍街,2014,1,0,1
新屋鄉後湖村中山西路一段,2014,4,0,8
桃園市大有路民有十五街,2014,1,0,1
桃園市文中路國豐六街,2014,8,0,9
中壢市普忠里大仁街,2014,3,0,4
龍潭鄉中山村龍城路,2014,2,0,3
平鎮市新榮里崇德街70巷,2014,1,0,2
楊梅市水美里梅高路,2014,5,0,6
八德市大仁里福德一路,2014,1,0,1
桃園市大興西路一段同安街,2014,3,0,3
中壢市吉安街,2014,2,0,4
觀音鄉三和里文化路,2014,1,0,1
中壢市復華里中華路與復華街,2014,1,0,1
桃園市中正里壽星街34巷,2014,1,0,1
八德市大勇里東勇北路,2014,10,0,19
龍潭鄉中興村中興路民豐六街,2014,1,0,2
新屋鄉社子村9鄰24號旁產業道路,2014,1,0,1
新屋鄉社子村(社子橋往三民路,2014,1,0,1
八德市瑞發里介壽路二段民權街,2014,2,0,2
中壢市忠義里新中北路,2014,1,0,1
平鎮市南平里南平路二段,2014,3,0,5
蘆竹鄉山腳村山林路一段富貴街,2014,1,0,1
中壢市永福里西園路與西園路114巷,2014,1,0,2
平鎮市建安里平東路573巷,2014,3,0,3
大溪鎮僑愛巷,2014,1,0,1
中壢市振興里環中東路二段自忠二街,2014,1,0,1
楊梅市楊梅里中山路武營街,2014,1,0,1
桃園市福安里三民路青田街,2014,1,0,1
八德市竹園里竹園街,2014,2,0,3
楊梅市高山里高獅路,2014,7,0,7
蘆竹鄉海湖村山林路,2014,1,0,1
平鎮市平安里新光路,2014,2,0,2
八德市和平路528巷,2014,2,0,3
蘆竹鄉大新路610巷,2014,2,0,2
八德市大昌里介壽路二段364巷,2014,3,0,4
桃園市三民路三段永美街,2014,3,0,4
大溪鎮埔頂路一段357巷,2014,7,0,10
八德市大正里前程街36巷,2014,1,0,1
八德市霄裡里新興路,2014,2,0,4
觀音鄉桃40之1產業道路,2014,1,0,2
新屋鄉大坡村東福路,2014,1,0,2
中壢市龍安里中山東路四段,2014,2,0,2
龍潭鄉高平村中豐路高平段休閒街,2014,1,0,1
桃園市萬壽里萬壽路三段99巷,2014,4,0,4
觀音鄉成功路二段,2014,3,0,3
楊梅鎮梅高路二段,2014,1,0,1
平鎮市新安里洪圳路,2014,4,0,6
桃園市汴洲里春日路鹽庫西街,2014,3,0,7
桃園市中埔二街,2014,6,0,7
大園鄉北港村工三路,2014,1,0,1
八德市大和里介壽路一段,2014,2,0,2
中壢市忠義里忠信路,2014,3,0,3
八德市大正里大福街,2014,2,0,4
龍潭鄉上華村金龍路,2014,1,0,1
觀音鄉忠孝路,2014,1,0,1
八德市大安里興豐路2350巷,2014,1,0,1
平鎮市湧豐里南豐路,2014,4,0,5
桃園市文中北路,2014,5,0,6
蘆竹鄉文新街,2014,4,0,4
中壢市中正里榮民路,2014,6,0,8
中壢市永福里南園路,2014,3,0,5
八德市茄苳里華康街176巷,2014,3,0,3
龍潭鄉龍星村新龍路140巷,2014,2,0,2
中壢市水尾里新生路二段93巷,2014,2,0,3
平鎮市金星里南平路,2014,1,0,1
八德市興仁里長興一路,2014,1,0,1
中壢市中央西路二段141巷,2014,1,0,1
桃園市西湖里三民路,2014,3,0,3
大園鄉大園村和平東路,2014,1,0,1
八德市霄裡里龍南路,2014,6,0,8
中壢市環中東路與幸福街,2014,1,0,2
平鎮市雙連里民族路,2014,2,0,2
桃園市東門里春日路,2014,8,0,12
平鎮市湧光里工業七路,2014,1,0,1
中壢市榮民路120巷,2014,1,0,2
龜山鄉南上路,2014,13,0,14
蘆竹鄉上竹村上興路竹中街,2014,1,0,2
桃園市春日路鎮四街,2014,3,0,5
八德市瑞祥里介壽路二段1193巷,2014,4,0,5
楊梅市永美里楊新路一段,2014,1,0,1
桃園市大林里桃鶯路樹仁二街,2014,1,0,4
中壢市元化路2段,2014,2,0,2
平鎮市義興里延平路二段21巷,2014,2,0,2
桃園市富國路645巷,2014,3,0,3
中壢市興國里中央西路與明德街,2014,1,0,2
觀音鄉民族路,2014,2,0,2
桃園市三民里三民路,2014,8,0,11
楊梅市三民里三民路,2014,3,0,3
龍潭鄉黃唐村中興路63巷,2014,1,0,2
中壢市中堅里中山東路,2014,7,0,7
龜山鄉中坑路,2014,1,0,1
龜山鄉三民路,2014,3,0,3
平鎮市東勢里太平西路,2014,3,0,3
桃園市樹林三街,2014,1,0,1
桃園市青溪里三民路二段三元街,2014,1,0,1
桃園市秀山路,2014,1,0,1
中壢市正光二街,2014,1,0,1
桃園市國際路425巷,2014,1,0,1
平鎮市平興里延平路二段,2014,5,0,6
桃園市新埔八街,2014,1,0,2
蘆竹鄉蘆竹村中正北路蘆竹街,2014,1,0,1
八德市大興里和平路東勇街,2014,1,0,1
桃園市三民里成功路,2014,5,0,6
龍潭鄉中興村中興路363巷,2014,1,0,1
龜山鄉山鶯路將軍巷,2014,1,0,1
桃園市萬壽里萬壽路德育街,2014,1,0,2
平鎮市湧光里中豐路南勢二段,2014,1,0,1
復興鄉台7線14公里200公尺處北向中線車道,2014,1,0,1
大園鄉田心村永興路,2014,4,0,4
桃園市玉山里復興路育樂街,2014,2,0,4
蘆竹鄉海山路一段,2014,4,0,5
中壢市興仁路一段,2014,5,0,6
桃園市大林里樹仁三街15巷,2014,2,0,2
桃園市中山路1496巷,2014,2,0,3
新屋鄉後湖村三民路一段,2014,2,0,2
龍潭鄉永興村中興路489巷,2014,3,0,3
楊梅市員本里民生街505巷,2014,1,0,2
八德市介壽路二段685巷,2014,3,0,5
八德市東勇與和平路,2014,1,0,2
觀音鄉藍埔村新華路一段,2014,5,0,5
蘆竹鄉南崁路一段,2014,21,0,27
楊梅市瑞塘里萬大路、萬福街,2014,1,0,1
平鎮市快速路二段985巷,2014,1,0,1
桃園市北埔里莊敬路,2014,2,0,2
桃園市中正路同德六街,2014,3,0,5
蘆竹鄉中福村文中路一段、龍壽街,2014,1,0,1
桃園市大林里樹仁三街87巷,2014,2,0,3
龍潭鄉高原村龍源路,2014,2,0,3
中壢市吉長二街,2014,2,0,3
桃園市西埔里永安路1468巷,2014,4,0,4
蘆竹鄉光復路114巷,2014,1,0,2
龍潭鄉凌雲村聖亭路、仁愛街,2014,1,0,1
龜山鄉文興路,2014,9,0,12
中壢市環中東路徐州街,2014,4,0,4
龜山鄉與南祥路,2014,1,0,1
大園鄉後厝村台15線29公里500公尺處南向內側車道,2014,1,0,1
大溪鎮介壽路211巷,2014,2,0,2
新屋鄉中正路,2014,1,0,1
平鎮市貿東路66巷,2014,3,0,4
桃園市慈文里中正路近慈祥街,2014,1,0,1
八德市豐德路,2014,1,0,1
平鎮市高雙里陸光路,2014,2,0,4
觀音鄉大潭村台66與台61路,2014,1,0,4
八德市國道二號高架橋下道路,2014,1,0,1
蘆竹鄉仁愛路三段愛山街,2014,2,0,2
中壢市元化路與美豐街,2014,2,0,2
中壢市中和路,2014,22,0,34
桃園市建國里建明街,2014,2,0,2
龍潭鄉上林村龍元路,2014,4,0,4
楊梅市水美里大平街,2014,3,0,3
新屋鄉新生村中興北路與新生三街,2014,1,0,2
桃園市江南十街,2014,1,0,1
大溪鎮國道,2014,18,0,23
龜山鄉光明街,2014,1,0,1
桃園市大業路一段121巷,2014,1,0,1
平鎮市北富里金陵路三段266巷,2014,1,0,2
八德市茄明里中華路明光街,2014,4,0,7
八德市福興里廣興路,2014,12,0,18
八德市霄裡里長興路,2014,14,0,19
楊梅市裕新里中山北路二段,2014,2,0,2
桃園市同德五街,2014,2,0,4
桃園市福林里長沙街,2014,11,0,13
大園鄉北港村自立二街,2014,1,0,1
八德市福德一路177巷,2014,6,0,6
龜山鄉頂興路114巷,2014,6,0,7
觀音鄉廣興村成功路二段,2014,9,0,9
大溪鎮文化路天祥街,2014,1,0,1
平鎮市東安里平東路659巷,2014,1,0,1
龜山鄉振興路850巷,2014,1,0,1
中壢市中美路一段與恩德街,2014,2,0,2
中壢市長江一街,2014,3,0,7
蘆竹鄉坑子村八德一路,2014,2,0,2
中壢市中山東路三段429巷,2014,1,0,2
龜山鄉忠義路一段1199巷,2014,2,0,2
八德市介壽與興豐路,2014,3,0,3
桃園市紹興街,2014,2,0,3
蘆竹鄉新興街70巷,2014,2,0,3
大溪鎮天祥街76巷,2014,1,0,1
楊梅鎮梅溪里中山北路二段,2014,1,0,1
桃園市向善街48巷,2014,1,0,1
桃園市中成里文中北路,2014,1,0,1
蘆竹鄉長安路二段,2014,7,0,10
八德市龍友里新生路,2014,5,0,5
大園鄉果林村三民路果林街,2014,2,0,2
楊梅市永平里新農街,2014,3,0,5
中壢市遠揚街65巷,2014,1,0,1
中壢市五福里五光一街,2014,4,0,5
桃園市中正里守法路31巷,2014,4,0,7
龜山鄉中興路明興街,2014,3,0,4
八德市瑞發里介壽路二段951巷,2014,1,0,1
桃園市朝陽里三民路二段,2014,2,0,4
桃園市成功路二段與德育街,2014,1,0,1
平鎮市宋屋里延平路三段97巷,2014,1,0,2
八德市瑞祥里興豐路698巷,2014,1,0,1
桃園市三元里成功路三段,2014,9,0,11
中壢市中壢里中山路,2014,5,0,9
中壢市文中路二段295巷,2014,1,0,1
蘆竹鄉新興村新興街,2014,1,0,1
桃園市龍安里中山路龍安街,2014,1,0,1
桃園市三民路二段公六街,2014,1,0,1
楊梅市高山里梅高路三段,2014,1,0,1
大園鄉圳頭村國際路一段,2014,3,0,5
龜山鄉東萬壽路309巷,2014,4,0,6
平鎮市復興里環南路301巷,2014,1,0,1
楊梅市東流里中山南路,2014,9,0,14
八德市正福街,2014,1,0,1
桃園市建國里興邦路,2014,2,0,3
龜山鄉樹人路與新興街,2014,1,0,1
中壢市復華六街,2014,1,0,1
中壢市大享、中正路,2014,1,0,1
楊梅市大華街,2014,1,0,1
平鎮市大昌路,2014,2,0,3
桃園市文中路德華街,2014,3,0,4
平鎮市平鎮里開封街,2014,1,0,1
龍潭鄉武漢村中興路18巷,2014,1,0,1
中壢市成章一街,2014,2,0,2
桃園市中路里國際路衡陽二街,2014,1,0,1
大溪鎮埔頂路一段,2014,9,0,13
新屋鄉下田村中山西路二段,2014,2,0,2
桃園市長德里力行路,2014,4,0,6
中壢市新生路與慈惠三街,2014,4,0,5
大溪鎮南興里仁和路二段,2014,2,0,2
八德市竹園里新興路,2014,10,0,14
中壢市文化二路,2014,8,0,9
龍潭鄉北興村中興路63巷,2014,3,0,3
蘆竹鄉富竹村南竹路四段,2014,8,0,11
楊梅市高山里梅高路,2014,6,0,7
桃園市龍山里龍壽街81巷,2014,3,0,4
楊梅市富豐里3鄰11號旁路,2014,1,0,1
桃園市大誠路,2014,7,0,7
八德市茄明里中華路與明光街,2014,2,0,2
中壢市三民路,2014,5,0,8
中壢市水尾里新生路,2014,16,0,21
八德市興仁里中山路中興街,2014,2,0,2
中壢市興仁里興仁路二段67巷,2014,3,0,4
桃園市同德六街,2014,9,0,12
八德市大安里和平路,2014,4,0,4
蘆竹鄉錦中村光復路114巷,2014,1,0,1
中壢市榮安五街66巷,2014,2,0,4
蘆竹鄉內厝村長興路一段,2014,1,0,3
八德市瑞興里建國路,2014,9,0,12
桃園市樹仁二街,2014,6,0,8
桃園市大有里大有路民有十五街,2014,2,0,5
蘆竹鄉內厝村長興路,2014,1,0,1
龜山鄉大華村頂湖路與頂湖二街,2014,1,0,1
中壢市福山路一段,2014,6,0,8
楊梅市高上里高獅路365巷,2014,1,0,1
龜山鄉樂安街409巷,2014,1,0,2
楊梅市瑞坪里蘋果路,2014,1,0,1
龜山鄉公西村文化二路文化二路(口)34巷,2014,1,0,2
蘆竹鄉海山西路,2014,2,0,2
中壢市內定里合圳北路二段95巷,2014,1,0,1
楊梅市楊明里新農街378巷,2014,3,0,3
大溪鎮新峰里9鄰台7乙線11公里95公尺處南向東車道,2014,1,0,1
楊梅市仁美里永美路,2014,6,0,8
桃園市豐林里介壽路長沙街,2014,1,0,2
觀音鄉富源村新富路,2014,4,0,6
桃園市大興里大業路一段,2014,16,0,19
八德市茄苳里永豐路226巷,2014,3,0,4
平鎮市新富里德育路二段,2014,7,0,10
中壢市新興里新興路東明街,2014,1,0,2
中壢市建國路,2014,1,0,1
龜山鄉西勢湖路,2014,5,0,5
龜山鄉陸光村長壽路,2014,1,0,2
大溪鎮員林路與新興街,2014,3,0,4
龜山鄉兔仔坑路,2014,1,0,2
平鎮市義民里延平路二段248巷,2014,2,0,4
八德市大和里建國路同和街,2014,1,0,2
桃園市同安里南平路,2014,2,0,2
新屋鄉頭洲村9鄰梅高路三段,2014,1,0,2
龜山鄉龍校街119巷,2014,1,0,1
平鎮市東勢里福龍路一段,2014,2,0,4
桃園市永安里力行路中正三街,2014,3,0,4
中壢市文化里文化路元生三街,2014,1,0,2
中壢市永福里中園路福州二街,2014,5,0,6
八德市中華與裕和街,2014,1,0,2
楊梅鎮幼獅路二段392巷,2014,1,0,1
龍潭鄉龍潭村中正路,2014,2,0,2
平鎮市金陵里環南路三段,2014,9,0,11
楊梅鎮民族路五段29巷,2014,1,0,1
平鎮市南勢里南京路,2014,1,0,2
龜山鄉民生北路一段386巷,2014,4,0,4
龜山鄉大同路236巷,2014,3,0,6
龍潭鄉中正村大同路130巷,2014,1,0,1
中壢市興南里新生路,2014,11,0,13
桃園市中路里中山路812巷,2014,4,0,5
八德市竹園里新興路與竹園街,2014,1,0,1
蘆竹鄉桃園街中正巷,2014,1,0,1
中壢市普忠里環中東路二段,2014,1,0,1
八德市興豐路781巷,2014,4,0,5
桃園市新埔里同德五街,2014,1,0,1
龜山鄉文昌一街,2014,5,0,9
龜山鄉復興三路,2014,17,0,21
龜山鄉山德村萬壽路二段壽德街,2014,1,0,1
中壢市中臺路,2014,1,0,1
龜山鄉樂善村文化一路壽山街,2014,1,0,2
大園鄉田心村華興路,2014,10,0,12
楊梅市中山里環東路298巷,2014,4,0,6
大園鄉桃園機場航勤北路,2014,3,0,3
中壢市過嶺里過嶺路二段76巷,2014,1,0,1
觀音鄉樹林村成功路二段,2014,9,0,11
新屋鄉頭洲村中山東路二段與新洲六街,2014,1,0,1
桃園市大豐路樹林九街,2014,1,0,2
觀音鄉樹林村工業三路,2014,3,0,3
八德市大忠里介壽路一段,2014,13,0,16
龜山鄉龜山村長壽路,2014,1,0,1
桃園市大豐路與樹林九街,2014,1,0,1
中壢市元化路267巷,2014,1,0,1
大溪鎮員林路三段354巷,2014,1,0,1
平鎮市北安里中原路,2014,1,0,1
大園鄉大園村新生路72巷,2014,1,0,1
平鎮市鎮興里南平路二段32巷,2014,1,0,1
桃園市中德里永福西街,2014,3,0,5
中壢市復華街,2014,5,0,6
蘆竹鄉南榮村洛陽街,2014,1,0,3
平鎮市振興西路,2014,9,0,10
新屋鄉新屋村中山西路一段,2014,2,0,2
平鎮市育達合作路,2014,1,0,1
大溪鎮員林里員林路二段456巷,2014,1,0,2
八德市竹園里崁頂路,2014,7,0,10
龜山鄉大同村自強南路明德路54巷,2014,1,0,2
觀音鄉台66線、台15線口(附近)台66線1公里0公尺處西向中外車道,2014,1,0,1
觀音鄉保障村台61線38公里500公尺處南向內側車道,2014,1,0,1
大園鄉果林村三和路42巷,2014,2,0,3
桃園市福林里陽明九街,2014,1,0,1
中壢市中正里榮安三街,2014,2,0,2
八德市龍宮街73巷,2014,1,0,1
